"CranlNervCentralScotomaLoc","Cranial nerves II-XII central scotoma location(s)","Unique Data Element","1.0","Cranial nerves II-XII area(s) of central scotoma","Cranial nerves II-XII area(s) of central scotoma","Alphanumeric","","Single Pre-Defined Value Selected","","","Bilateral;Left;Not Applicable;Not assessed;Right","Bilateral;Left;Normal;Not assessed;Right","6;4;777;222;5","","Select one.","PDBD Neurolocial Examination Form","5f-iii) Central scotoma","","","Adult and Pediatric","Assessments and Examinations.Physical/Neurological Examination","","","","","","","","","","","","","","","","Supplemental","","","","","Supplemental","","","","","","","","","","","","","","","",,,,,"","",,,,"2014-04-01","2014-04-01","Published"
"CranlNervEyeMovmntFind","Cranial nerves II-XII eye movements findings","Unique Data Element","1.0","Cranial nerves II-XII eye movements findings","Cranial nerves II-XII eye movements findings","Alphanumeric","","Single Pre-Defined Value Selected","","","Abnormal;Normal;Not assessed","Abnormal;Normal;Not assessed","10;20;222","","Select one.","PDBD Neurolocial Examination Form","5g) Eye movements","","","Adult and Pediatric","Assessments and Examinations.Physical/Neurological Examination","","","","","","","","","","","","","","","","Supplemental","","","","","Supplemental","","","","","","","","","","","","","","","",,,,,"","",,,,"2014-04-01","2014-04-01","Published"
"CranlNervEyeMovmntLatFind","Cranial nerves II-XII eye movements lateral findings","Unique Data Element","1.0","Cranial nerves II-XII eye movements lateral findings","Cranial nerves II-XII eye movements lateral findings","Alphanumeric","","Single Pre-Defined Value Selected","","","Bilateral;Left;Normal;Not assessed;Nystagmus;Right","Bilateral;Left;Normal;Not assessed;Nystagmus;Right","6;4;20;222;1;5","","Select one.","PDBD Neurolocial Examination Form","5g-i) Lateral","","","Adult and Pediatric","Assessments and Examinations.Physical/Neurological Examination","","","","","","","","","","","","","","","","Supplemental","","","","","Supplemental","","","","","","","","","","","","","","","",,,,,"","",,,,"2014-04-01","2014-04-01","Published"
"CranlNervEyeMovmntMedialFind","Cranial nerves II-XII eye movements medial findings","Unique Data Element","1.0","Cranial nerves II-XII eye movements medial findings","Cranial nerves II-XII eye movements medial findings","Alphanumeric","","Single Pre-Defined Value Selected","","","Bilateral;Left;Normal;Not assessed;Nystagmus;Right","Bilateral;Left;Normal;Not assessed;Nystagmus;Right","6;4;20;222;1;5","","Select one.","PDBD Neurolocial Examination Form","5g-ii) Medial","","","Adult and Pediatric","Assessments and Examinations.Physical/Neurological Examination","","","","","","","","","","","","","","","","Supplemental","","","","","Supplemental","","","","","","","","","","","","","","","",,,,,"","",,,,"2014-04-01","2014-04-01","Published"
"CranlNervEyeMovmntUpFind","Cranial nerves II-XII eye movements up findings","Unique Data Element","1.0","Cranial nerves II-XII eye movements up findings","Cranial nerves II-XII eye movements up findings","Alphanumeric","","Single Pre-Defined Value Selected","","","Bilateral;Left;Normal;Not assessed;Nystagmus;Right","Bilateral;Left;Normal;Not assessed;Nystagmus;Right","6;4;20;222;1;5","","Select one.","PDBD Neurolocial Examination Form","5g-iii) Up","","","Adult and Pediatric","Assessments and Examinations.Physical/Neurological Examination","","","","","","","","","","","","","","","","Supplemental","","","","","Supplemental","","","","","","","","","","","","","","","",,,,,"","",,,,"2014-04-01","2014-04-01","Published"
"CranlNervEyeMovmntDownFind","Cranial nerves II-XII eye movements down findings","Unique Data Element","1.0","Cranial nerves II-XII eye movements down findings","Cranial nerves II-XII eye movements down findings","Alphanumeric","","Single Pre-Defined Value Selected","","","Bilateral;Left;Normal;Not assessed;Nystagmus;Right","Bilateral;Left;Normal;Not assessed;Nystagmus;Right","6;4;20;222;1;5","","Select one.","PDBD Neurolocial Examination Form","5g-iv) Down","","","Adult and Pediatric","Assessments and Examinations.Physical/Neurological Examination","","","","","","","","","","","","","","","","Supplemental","","","","","Supplemental","","","","","","","","","","","","","","","",,,,,"","",,,,"2014-04-01","2014-04-01","Published"
"CranlNervEyeMovmntSaccadesFind","Cranial nerves II-XII eye movements saccades findings","Unique Data Element","1.0","Cranial nerves II-XII eye movements saccades findings","Cranial nerves II-XII eye movements saccades findings","Alphanumeric","","Single Pre-Defined Value Selected","","","Bilateral;Left;Normal;Not assessed;Right","Bilateral;Left;Normal;Not assessed;Right","6;4;20;222;5","","Select one.","PDBD Neurolocial Examination Form","5g-v) Saccades","","","Adult and Pediatric","Assessments and Examinations.Physical/Neurological Examination","","","","","","","","","","","","","","","","Supplemental","","","","","Supplemental","","","","","","","","","","","","","","","",,,,,"","",,,,"2014-04-01","2014-04-01","Published"
"CranlNervEyeMovmntSmoothPur","Cranial nerves II-XII eye movements smooth pursuit findings","Unique Data Element","1.0","Cranial nerves II-XII eye movements smooth pursuit findings","Cranial nerves II-XII eye movements smooth pursuit findings","Alphanumeric","","Single Pre-Defined Value Selected","","","Bilateral;Left;Normal;Not assessed;Right","Bilateral;Left;Normal;Not assessed;Right","6;4;20;222;5","","Select one.","PDBD Neurolocial Examination Form","5g-vi) Smooth pursuit","","","Adult and Pediatric","Assessments and Examinations.Physical/Neurological Examination","","","","","","","","","","","","","","","","Supplemental","","","","","Supplemental","","","","","","","","","","","","","","","",,,,,"","",,,,"2014-04-01","2014-04-01","Published"
"CranlNervFaclNumbnessFind","Cranial nerves II-XII facial numbness findings","Unique Data Element","1.0","Cranial nerves II-XII facial numbness findings","Cranial nerves II-XII facial numbness findings","Alphanumeric","","Single Pre-Defined Value Selected","","","Abnormal;Normal;Not assessed","Abnormal;Normal;Not assessed","10;20;222","","Select one.","PDBD Neurolocial Examination Form","5h) Facial numbness","","","Adult and Pediatric","Assessments and Examinations.Physical/Neurological Examination","","","","","","","","","","","","","","","","Supplemental","","","","","Supplemental","","","","","","","","","","","","","","","",,,,,"","",,,,"2014-04-01","2014-04-01","Published"
"CranlNervFaclNumbnessLoc","Cranial nerves II-XII facial numbness locations","Unique Data Element","1.0","Cranial nerves II-XII facial numbness locations","Cranial nerves II-XII facial numbness locations","Alphanumeric","4000","Free-Form Entry","","","V1 Bilateral;V1 Left;V1 Right;V2 Bilateral;V2 Left;V2 Right;V3 Bilateral;V3 Left;V3 Right","V1 Bilateral;V1 Left;V1 Right;V2 Bilateral;V2 Left;V2 Right;V3 Bilateral;V3 Left;V3 Right",";;;;;;;;","","Select all that apply.","PDBD Neurolocial Examination Form","5h-i) Note location(s) of facial numbness","","","Adult and Pediatric","Assessments and Examinations.Physical/Neurological Examination","","","","","","","","","","","","","","","","Supplemental","","","","","Supplemental","","","","","","","","","","","","","","","",,,,,"","",,,,"2014-04-01","2014-04-01","Published"
"CranlNervMassetWeakFind","Cranial nerves II-XII masseter muscular weakness findings","Unique Data Element","1.0","Cranial nerves II-XII Masseter muscular weakness findings","Cranial nerves II-XII Masseter muscular weakness findings","Alphanumeric","","Single Pre-Defined Value Selected","","","Bilateral;Left;Normal;Not assessed;Right","Bilateral;Left;Normal;Not assessed;Right","6;4;20;222;5","","Select one.","PDBD Neurolocial Examination Form","5i) Masseter weakness","","","Adult and Pediatric","Assessments and Examinations.Physical/Neurological Examination","","","","","","","","","","","","","","","","Supplemental","","","","","Supplemental","","","","","","","","","","","","","","","",,,,,"","",,,,"2014-04-01","2014-04-01","Published"
"CranlNervFaclStrngthFind","Cranial nerves II-XII facial strength findings","Unique Data Element","1.0","Cranial nerves II-XII facial strength findings","Cranial nerves II-XII facial strength findings","Alphanumeric","","Single Pre-Defined Value Selected","","","Abnormal;Normal;Not assessed","Abnormal;Normal;Not assessed","10;20;222","","Select one.","PDBD Neurolocial Examination Form","5j) Facial strength","","","Adult and Pediatric","Assessments and Examinations.Physical/Neurological Examination","","","","","","","","","","","","","","","","Supplemental","","","","","Supplemental","","","","","","","","","","","","","","","",,,,,"","",,,,"2014-04-01","2014-04-01","Published"
"CranlNervFaclStrngthRt","Cranial nerves II-XII central facial strength right findings","Unique Data Element","1.0","Cranial nerves II-XII central facial strength right findings","Cranial nerves II-XII central facial strength right findings","Alphanumeric","","Single Pre-Defined Value Selected","","","Central weakness;Normal;Not assessed;Peripheral weakness","Central weakness;Normal;Not assessed;Peripheral weakness",";;;","","Select one.","PDBD Neurolocial Examination Form","5j-i) Facial strength (R)","","","Adult and Pediatric","Assessments and Examinations.Physical/Neurological Examination","","","","","","","","","","","","","","","","Supplemental","","","","","Supplemental","","","","","","","","","","","","","","","",,,,,"","",,,,"2014-04-01","2014-04-01","Published"
"CranlNervFaclStrngthLft","Cranial nerves II-XII peripheral facial strength left findings","Unique Data Element","1.0","Cranial nerves II-XII peripheral facial strength left findings","Cranial nerves II-XII peripheral facial strength left findings","Alphanumeric","","Single Pre-Defined Value Selected","","","Central weakness;Normal;Not assessed;Peripheral weakness","Central weakness;Normal;Not assessed;Peripheral weakness",";;;","","Select one.","PDBD Neurolocial Examination Form","5j-ii) Facial strength (L)","","","Adult and Pediatric","Assessments and Examinations.Physical/Neurological Examination","","","","","","","","","","","","","","","","Supplemental","","","","","Supplemental","","","","","","","","","","","","","","","",,,,,"","",,,,"2014-04-01","2014-04-01","Published"
"CranlNervHearingFind","Cranial nerves II-XII hearing findings","Unique Data Element","1.0","Cranial nerves II-XII hearing findings","Cranial nerves II-XII hearing findings","Alphanumeric","","Single Pre-Defined Value Selected","","","Abnormal;Normal;Not assessed","Abnormal;Normal;Not assessed","10;20;222","","Select one.","PDBD Neurolocial Examination Form","5k) Hearing","","","Adult and Pediatric","Assessments and Examinations.Physical/Neurological Examination","","","","","","","","","","","","","","","","Supplemental","","","","","Supplemental","","","","","","","","","","","","","","","",,,,,"","",,,,"2014-04-01","2014-04-01","Published"
"CranlNervHearingAbnrmlyFind","Cranial nerves II-XII hearing abnormality findings","Unique Data Element","1.0","Cranial nerves II-XII hearing abnormality findings","Cranial nerves II-XII hearing abnormality findings","Alphanumeric","","Single Pre-Defined Value Selected","","","Bilaterally decreased;Left decreased;Normal;Not assessed;Right decreased","Bilaterally decreased;Left decreased;Normal;Not assessed;Right decreased","6;4;20;222;5","","Select one.","PDBD Neurolocial Examination Form","9R","","","Adult and Pediatric","Assessments and Examinations.Physical/Neurological Examination","","","","","","","","","","","","","","","","Supplemental","","","","","Supplemental","","","","","","","","","","","","","","","",,,,,"","",,,,"2014-04-01","2014-04-01","Published"
"CranlNervWeberTestRsltFind","Cranial nerves II-XII Weber test result findings","Unique Data Element","1.0","Cranial nerves II-XII Weber test result findings","Cranial nerves II-XII Weber test result findings","Alphanumeric","","Single Pre-Defined Value Selected","","","Lateralized Left;Lateralized Right;Normal;Not assessed","Lateralized Left;Lateralized Right;Normal;Not assessed","4;5;20;222","","Select one.","PDBD Neurolocial Examination Form","0","","","Adult and Pediatric","Assessments and Examinations.Physical/Neurological Examination","","","","","","","","","","","","","","","","Supplemental","","","","","Supplemental","","","","","","","","","","","","","","","",,,,,"","",,,,"2014-04-01","2014-04-01","Published"
"CranlNervRinneTestRslt","Cranial nerves II-XII Rinne test result","Unique Data Element","1.0","Cranial nerves II-XII Rinne test result","Cranial nerves II-XII Rinne test result","Alphanumeric","","Single Pre-Defined Value Selected","","","Air <  Bone;Air = Bone;Air > Bone","Air <  Bone;Air = Bone;Air > Bone","1;2;3","","Select one.","PDBD Neurolocial Examination Form","5k-iii) Rinne","","","Adult and Pediatric","Assessments and Examinations.Physical/Neurological Examination","","","","","","","","","","","","","","","","Supplemental","","","","","Supplemental","","","","","","","","","","","","","","","",,,,,"","",,,,"2014-04-01","2014-04-01","Published"
"CranlNervPalatalElevatnFind","Cranial nerves II-XII palatal elevation findings","Unique Data Element","1.0","Cranial nerves II-XII palatal elevation findings","Cranial nerves II-XII palatal elevation findings","Alphanumeric","","Single Pre-Defined Value Selected","","","Bilaterally decreased;Left decreased;Normal;Not assessed;Right decreased","Bilaterally decreased;Left decreased;Normal;Not assessed;Right decreased","6;4;20;222;5","","Select one.","PDBD Neurolocial Examination Form","5l) Palatal elevation","","","Adult and Pediatric","Assessments and Examinations.Physical/Neurological Examination","","","","","","","","","","","","","","","","Supplemental","","","","","Supplemental","","","","","","","","","","","","","","","",,,,,"","",,,,"2014-04-01","2014-04-01","Published"
"CranlNervGagRflxFind","Cranial nerves II-XII gag reflex findings","Unique Data Element","1.0","Cranial nerves II-XII Gag reflex findings","Cranial nerves II-XII Gag reflex findings","Alphanumeric","","Single Pre-Defined Value Selected","","","Absent;Decreased;Normal;Not assessed","Absent;Decreased;Normal;Not assessed","2;10;20;555","","Select one.","PDBD Neurolocial Examination Form","5m) Gag reflex","","","Adult and Pediatric","Assessments and Examinations.Physical/Neurological Examination","","","","","","","","","","","","","","","","Supplemental","","","","","Supplemental","","","","","","","","","","","","","","","",,,,,"","",,,,"2014-04-01","2014-04-01","Published"
"CranlNervShouldShrugWeakFind","Cranial nerves II-XII shoulder shrug weakness findings","Unique Data Element","1.0","Cranial nerves II-XII shoulder shrug weakness findings","Cranial nerves II-XII shoulder shrug weakness findings","Alphanumeric","","Single Pre-Defined Value Selected","","","Bilateral;Left;Normal;Not assessed;Right","Bilateral;Left;Normal;Not assessed;Right","6;4;20;222;5","","Select one.","PDBD Neurolocial Examination Form","5n) Shoulder shrug weakness","","","Adult and Pediatric","Assessments and Examinations.Physical/Neurological Examination","","","","","","","","","","","","","","","","Supplemental","","","","","Supplemental","","","","","","","","","","","","","","","",,,,,"","",,,,"2014-04-01","2014-04-01","Published"
"CranlNervSCMWeakFind","Cranial II-XII sternocleidomastoid weakness findings","Unique Data Element","1.0","Cranial II-XII sternocleidomastoid weakness findings","Cranial II-XII sternocleidomastoid weakness findings","Alphanumeric","","Single Pre-Defined Value Selected","","","Bilateral;Left;Normal;Not assessed;Right","Bilateral;Left;Normal;Not assessed;Right","6;4;20;222;5","","Select one.","PDBD Neurolocial Examination Form","5o) Sternocleidomastoid weakness","","","Adult and Pediatric","Assessments and Examinations.Physical/Neurological Examination","","","","","","","","","","","","","","","","Supplemental","","","","","Supplemental","","","","","","","","","","","","","","","",,,,,"","",,,,"2014-04-01","2014-04-01","Published"
"CranlNervTongueWeakFind","Cranial nerves II-XII tongue weakness findings","Unique Data Element","1.0","Cranial nerves II-XII tongue weakness findings","Cranial nerves II-XII tongue weakness findings","Alphanumeric","","Single Pre-Defined Value Selected","","","Left;Normal;Not Assessed;Right","Left;Normal;Not Assessed;Right","4;20;222;5","","Select one.","PDBD Neurolocial Examination Form","5p) Tongue weakness","","","Adult and Pediatric","Assessments and Examinations.Physical/Neurological Examination","","","","","","","","","","","","","","","","Supplemental","","","","","Supplemental","","","","","","","","","","","","","","","",,,,,"","",,,,"2014-04-01","2014-04-01","Published"
"CranlNervTongueOthrFind","Cranial nerves II-XII other tongue findings","Unique Data Element","1.0","Cranial nerves II-XII other tongue findings","Cranial nerves II-XII other tongue findings","Alphanumeric","4000","Free-Form Entry","","","Atrophy;Fasciculations;None;Not assessed","Atrophy;Fasciculations;Normal;Not assessed",";;;","","Select one.","PDBD Neurolocial Examination Form","5q) Other tongue findings","","","Adult and Pediatric","Assessments and Examinations.Physical/Neurological Examination","","","","","","","","","","","","","","","","Supplemental","","","","","Supplemental","","","","","","","","","","","","","","","",,,,,"","",,,,"2014-04-01","2014-04-01","Published"
"MotorStrgthExamFind","Motor strength  examination findings","Unique Data Element","1.0","Motor strength  examination findings","Motor strength  examination findings","Alphanumeric","","Single Pre-Defined Value Selected","","","Abnormal;Normal;Not assessed","Abnormal;Normal;Not assessed","10;20;222","","Select one.","PDBD Neurolocial Examination Form","6) Motor strength","","","Adult and Pediatric","Assessments and Examinations.Physical/Neurological Examination","","","","","","","","","","","","","","","","Supplemental","","","","","Supplemental","","","","","","","","","","","","","","","",,,,,"","",,,,"2014-04-01","2014-04-01","Published"
"MotorStrgthDeltoidRtAssmt","Motor strength deltoid right assessment","Unique Data Element","1.0","Motor strength Deltoid right assessment","Motor strength Deltoid right assessment","Numeric Values","","Single Pre-Defined Value Selected","","","0;1;2;3;4;5","No muscle contraction;Visible muscle contraction, no movement;Active movement with gravity eliminated;Active movement against gravity;Less than normal strength aginst resistance;Normal strength against resistance","0;1;2;3;4;5","","Select one.","PDBD Neurolocial Examination Form","6a) Deltoid R","","","Adult and Pediatric","Assessments and Examinations.Physical/Neurological Examination","","","","","","","","","","","","","","","","Supplemental","","","","","Supplemental","","","","","","","","","","","","","","","",,,,,"","",,,,"2014-04-01","2014-04-01","Published"
"MotorStrgthBicepsRtAssmt","Motor strength biceps right assessment","Unique Data Element","1.0","Motor strength Biceps right assessment","Motor strength Biceps right assessment","Numeric Values","","Single Pre-Defined Value Selected","","","0;1;2;3;4;5","No muscle contraction;Visible muscle contraction, no movement;Active movement with gravity eliminated;Active movement against gravity;Less than normal strength aginst resistance;Normal strength against resistance","0;1;2;3;4;5","","Select one.","PDBD Neurolocial Examination Form","6c) Biceps R","","","Adult and Pediatric","Assessments and Examinations.Physical/Neurological Examination","","","","","","","","","","","","","","","","Supplemental","","","","","Supplemental","","","","","","","","","","","","","","","",,,,,"","",,,,"2014-04-01","2014-04-01","Published"
"MotorStrgthTricepsRtAssmt","Motor strength triceps right assessment","Unique Data Element","1.0","Motor strength Triceps right assessment","Motor strength Triceps right assessment","Numeric Values","","Single Pre-Defined Value Selected","","","0;1;2;3;4;5","No muscle contraction;Visible muscle contraction, no movement;Active movement with gravity eliminated;Active movement against gravity;Less than normal strength aginst resistance;Normal strength against resistance","0;1;2;3;4;5","","Select one.","PDBD Neurolocial Examination Form","6e) Triceps (R)","","","Adult and Pediatric","Assessments and Examinations.Physical/Neurological Examination","","","","","","","","","","","","","","","","Supplemental","","","","","Supplemental","","","","","","","","","","","","","","","",,,,,"","",,,,"2014-04-01","2014-04-01","Published"
"MotorStrgthExtCarpiRadRtAssmt","Motor strength ext. carpi radialials right assessment","Unique Data Element","1.0","Motor strength ext. Carpi Radialials right assessment","Motor strength ext. Carpi Radialials right assessment","Numeric Values","","Single Pre-Defined Value Selected","","","0;1;2;3;4;5","No muscle contraction;Visible muscle contraction, no movement;Active movement with gravity eliminated;Active movement against gravity;Less than normal strength aginst resistance;Normal strength against resistance","0;1;2;3;4;5","","Select one.","PDBD Neurolocial Examination Form","6g) Ext. Carpi Radialis (R)","","","Adult and Pediatric","Assessments and Examinations.Physical/Neurological Examination","","","","","","","","","","","","","","","","Supplemental","","","","","Supplemental","","","","","","","","","","","","","","","",,,,,"","",,,,"2014-04-01","2014-04-01","Published"
"MotorStrgthFlexCarpiRadRtAssmt","Motor strength flex carpi radialials right assessment","Unique Data Element","1.0","Motor strength flex Carpi Radialials right assessment","Motor strength flex Carpi Radialials right assessment","Numeric Values","","Single Pre-Defined Value Selected","","","0;1;2;3;4;5","No muscle contraction;Visible muscle contraction, no movement;Active movement with gravity eliminated;Active movement against gravity;Less than normal strength aginst resistance;Normal strength against resistance","0;1;2;3;4;5","","Select one.","PDBD Neurolocial Examination Form","6i) Flex Carpi Radialis (R)","","","Adult and Pediatric","Assessments and Examinations.Physical/Neurological Examination","","","","","","","","","","","","","","","","Supplemental","","","","","Supplemental","","","","","","","","","","","","","","","",,,,,"","",,,,"2014-04-01","2014-04-01","Published"
"MotorStrgthInterosRtAssmt","Motor strength interossei right assessment","Unique Data Element","1.0","Motor strength Interossei right assessment","Motor strength Interossei right assessment","Numeric Values","","Single Pre-Defined Value Selected","","","0;1;2;3;4;5","No muscle contraction;Visible muscle contraction, no movement;Active movement with gravity eliminated;Active movement against gravity;Less than normal strength aginst resistance;Normal strength against resistance","0;1;2;3;4;5","","Select one.","PDBD Neurolocial Examination Form","6k) Interossei (R)","","","Adult and Pediatric","Assessments and Examinations.Physical/Neurological Examination","","","","","","","","","","","","","","","","Supplemental","","","","","Supplemental","","","","","","","","","","","","","","","",,,,,"","",,,,"2014-04-01","2014-04-01","Published"
"MotorStrgthlliopsoasRtAssmt","Motor strength iliopsoas right assessment","Unique Data Element","1.0","Motor strength  lliopsoas right assessment","Motor strength  lliopsoas right assessment","Numeric Values","","Single Pre-Defined Value Selected","","","0;1;2;3;4;5","No muscle contraction;Visible muscle contraction, no movement;Active movement with gravity eliminated;Active movement against gravity;Less than normal strength aginst resistance;Normal strength against resistance","0;1;2;3;4;5","","Select one.","PDBD Neurolocial Examination Form","6m) lliopsoas (R)","","","Adult and Pediatric","Assessments and Examinations.Physical/Neurological Examination","","","","","","","","","","","","","","","","Supplemental","","","","","Supplemental","","","","","","","","","","","","","","","",,,,,"","",,,,"2014-04-01","2014-04-01","Published"
"MotorStrgthQuadcpsRtAssmt","Motor strength quadriceps right assessment","Unique Data Element","1.0","Motor strength Quadriceps right assessment","Motor strength Quadriceps right assessment","Numeric Values","","Single Pre-Defined Value Selected","","","0;1;2;3;4;5","No muscle contraction;Visible muscle contraction, no movement;Active movement with gravity eliminated;Active movement against gravity;Less than normal strength aginst resistance;Normal strength against resistance","0;1;2;3;4;5","","Select one.","PDBD Neurolocial Examination Form","6o) Quadriceps (R)","","","Adult and Pediatric","Assessments and Examinations.Physical/Neurological Examination","","","","","","","","","","","","","","","","Supplemental","","","","","Supplemental","","","","","","","","","","","","","","","",,,,,"","",,,,"2014-04-01","2014-04-01","Published"
"MotorStrgthHamstringRtAssmt","Motor strength hamstrings right assessment","Unique Data Element","1.0","Motor strength Hamstrings right assessment","Motor strength Hamstrings right assessment","Numeric Values","","Single Pre-Defined Value Selected","","","0;1;2;3;4;5","No muscle contraction;Visible muscle contraction, no movement;Active movement with gravity eliminated;Active movement against gravity;Less than normal strength aginst resistance;Normal strength against resistance","0;1;2;3;4;5","","Select one.","PDBD Neurolocial Examination Form","6q) Hamstrings (R)","","","Adult and Pediatric","Assessments and Examinations.Physical/Neurological Examination","","","","","","","","","","","","","","","","Supplemental","","","","","Supplemental","","","","","","","","","","","","","","","",,,,,"","",,,,"2014-04-01","2014-04-01","Published"
