"MotorStrgthGastrocnmusRtAssmt","Motor strength gastrocnemius right assessment","Unique Data Element","1.0","Motor strength Gastrocnemius right assessment","Motor strength Gastrocnemius right assessment","Numeric Values","","Single Pre-Defined Value Selected","","","0;1;2;3;4;5","No muscle contraction;Visible muscle contraction, no movement;Active movement with gravity eliminated;Active movement against gravity;Less than normal strength aginst resistance;Normal strength against resistance","0;1;2;3;4;5","","Select one.","PDBD Neurolocial Examination Form","6s) Gastrocnemius (R)","","","Adult and Pediatric","Assessments and Examinations.Physical/Neurological Examination","","","","","","","","","","","","","","","","Supplemental","","","","","Supplemental","","","","","","","","","","","","","","","",,,,,"","",,,,"2014-04-01","2014-04-01","Published"
"MotorStrgthTblAnterRtAssmt","Motor strength tibialis anterior right assessment","Unique Data Element","1.0","Motor strength Tibialis Anterior right assessment","Motor strength Tibialis Anterior right assessment","Numeric Values","","Single Pre-Defined Value Selected","","","0;1;2;3;4;5","No muscle contraction;Visible muscle contraction, no movement;Active movement with gravity eliminated;Active movement against gravity;Less than normal strength aginst resistance;Normal strength against resistance","0;1;2;3;4;5","","Select one.","PDBD Neurolocial Examination Form","6u) Tibialis Anterior (R)","","","Adult and Pediatric","Assessments and Examinations.Physical/Neurological Examination","","","","","","","","","","","","","","","","Supplemental","","","","","Supplemental","","","","","","","","","","","","","","","",,,,,"","",,,,"2014-04-01","2014-04-01","Published"
"MotorStrgthDeltoidLftAssmt","Motor strength deltoid left assessment","Unique Data Element","1.0","Motor strength Deltoid left assessment","Motor strength Deltoid left assessment","Numeric Values","","Single Pre-Defined Value Selected","","","0;1;2;3;4;5","No muscle contraction;Visible muscle contraction, no movement;Active movement with gravity eliminated;Active movement against gravity;Less than normal strength aginst resistance;Normal strength against resistance","0;1;2;3;4;5","","Select one.","PDBD Neurolocial Examination Form","6b) Deltoid (L)","","","Adult and Pediatric","Assessments and Examinations.Physical/Neurological Examination","","","","","","","","","","","","","","","","Supplemental","","","","","Supplemental","","","","","","","","","","","","","","","",,,,,"","",,,,"2014-04-01","2014-04-01","Published"
"MotorStrgthBicepsLftAssmt","Motor strength biceps left assessment","Unique Data Element","1.0","Motor strength Biceps left assessment","Motor strength Biceps left assessment","Numeric Values","","Single Pre-Defined Value Selected","","","0;1;2;3;4;5","No muscle contraction;Visible muscle contraction, no movement;Active movement with gravity eliminated;Active movement against gravity;Less than normal strength aginst resistance;Normal strength against resistance","0;1;2;3;4;5","","Select one.","PDBD Neurolocial Examination Form","6d) Biceps (L)","","","Adult and Pediatric","Assessments and Examinations.Physical/Neurological Examination","","","","","","","","","","","","","","","","Supplemental","","","","","Supplemental","","","","","","","","","","","","","","","",,,,,"","",,,,"2014-04-01","2014-04-01","Published"
"MotorStrgthTricepsLftAssmt","Motor strength triceps left assessment","Unique Data Element","1.0","Motor strength Triceps left assessment","Motor strength Triceps left assessment","Numeric Values","","Single Pre-Defined Value Selected","","","0;1;2;3;4;5","No muscle contraction;Visible muscle contraction, no movement;Active movement with gravity eliminated;Active movement against gravity;Less than normal strength aginst resistance;Normal strength against resistance","0;1;2;3;4;5","","Select one.","PDBD Neurolocial Examination Form","6f) Triceps (L)","","","Adult and Pediatric","Assessments and Examinations.Physical/Neurological Examination","","","","","","","","","","","","","","","","Supplemental","","","","","Supplemental","","","","","","","","","","","","","","","",,,,,"","",,,,"2014-04-01","2014-04-01","Published"
"MotorStrgthExtCarpiRadLftAssmt","Motor strength ext. carpi radialials left assessment","Unique Data Element","1.0","Motor strength ext. Carpi Radialials left assessment","Motor strength ext. Carpi Radialials left assessment","Numeric Values","","Single Pre-Defined Value Selected","","","0;1;2;3;4;5","No muscle contraction;Visible muscle contraction, no movement;Active movement with gravity eliminated;Active movement against gravity;Less than normal strength aginst resistance;Normal strength against resistance","0;1;2;3;4;5","","Select one.","PDBD Neurolocial Examination Form","6h) Ext. Carpi Radialis (L)","","","Adult and Pediatric","Assessments and Examinations.Physical/Neurological Examination","","","","","","","","","","","","","","","","Supplemental","","","","","Supplemental","","","","","","","","","","","","","","","",,,,,"","",,,,"2014-04-01","2014-04-01","Published"
"MotorStrgthFlexCarpiRadLtAssmt","Motor strength flex carpi radialials left assessment","Unique Data Element","1.0","Motor strength flex Carpi Radialials left assessment","Motor strength flex Carpi Radialials left assessment","Numeric Values","","Single Pre-Defined Value Selected","","","0;1;2;3;4;5","No muscle contraction;Visible muscle contraction, no movement;Active movement with gravity eliminated;Active movement against gravity;Less than normal strength aginst resistance;Normal strength against resistance","0;1;2;3;4;5","","Select one.","PDBD Neurolocial Examination Form","6j) Flex Carpi Radialis (L)","","","Adult and Pediatric","Assessments and Examinations.Physical/Neurological Examination","","","","","","","","","","","","","","","","Supplemental","","","","","Supplemental","","","","","","","","","","","","","","","",,,,,"","",,,,"2014-04-01","2014-04-01","Published"
"MotorStrgthInterosLftAssmt","Motor strength interossei left assessment","Unique Data Element","1.0","Motor strength Interossei left assessment","Motor strength Interossei left assessment","Numeric Values","","Single Pre-Defined Value Selected","","","0;1;2;3;4;5","No muscle contraction;Visible muscle contraction, no movement;Active movement with gravity eliminated;Active movement against gravity;Less than normal strength aginst resistance;Normal strength against resistance","0;1;2;3;4;5","","Select one.","PDBD Neurolocial Examination Form","6l) Interossei (L)","","","Adult and Pediatric","Assessments and Examinations.Physical/Neurological Examination","","","","","","","","","","","","","","","","Supplemental","","","","","Supplemental","","","","","","","","","","","","","","","",,,,,"","",,,,"2014-04-01","2014-04-01","Published"
"MotorStrgthlliopsoasLftAssmt","Motor strength  iliopsoas left assessment","Unique Data Element","1.0","Motor strength  lliopsoas left assessment","Motor strength  lliopsoas left assessment","Numeric Values","","Single Pre-Defined Value Selected","","","0;1;2;3;4;5","No muscle contraction;Visible muscle contraction, no movement;Active movement with gravity eliminated;Active movement against gravity;Less than normal strength aginst resistance;Normal strength against resistance","0;1;2;3;4;5","","Select one.","PDBD Neurolocial Examination Form","6n) lliopsoas (L)","","","Adult and Pediatric","Assessments and Examinations.Physical/Neurological Examination","","","","","","","","","","","","","","","","Supplemental","","","","","Supplemental","","","","","","","","","","","","","","","",,,,,"","",,,,"2014-04-01","2014-04-01","Published"
"MotorStrgthQuadcpsLftAssmt","Motor strength quadriceps left assessment","Unique Data Element","1.0","Motor strength Quadriceps left assessment","Motor strength Quadriceps left assessment","Numeric Values","","Single Pre-Defined Value Selected","","","0;1;2;3;4;5","No muscle contraction;Visible muscle contraction, no movement;Active movement with gravity eliminated;Active movement against gravity;Less than normal strength aginst resistance;Normal strength against resistance","0;1;2;3;4;5","","Select one.","PDBD Neurolocial Examination Form","6p) Quadriceps (L)","","","Adult and Pediatric","Assessments and Examinations.Physical/Neurological Examination","","","","","","","","","","","","","","","","Supplemental","","","","","Supplemental","","","","","","","","","","","","","","","",,,,,"","",,,,"2014-04-01","2014-04-01","Published"
"MotorStrgthHamstringLftAssmt","Motor strength hamstrings left assessment","Unique Data Element","1.0","Motor strength Hamstrings left assessment","Motor strength Hamstrings left assessment","Numeric Values","","Single Pre-Defined Value Selected","","","0;1;2;3;4;5","No muscle contraction;Visible muscle contraction, no movement;Active movement with gravity eliminated;Active movement against gravity;Less than normal strength aginst resistance;Normal strength against resistance","0;1;2;3;4;5","","Select one.","PDBD Neurolocial Examination Form","6r) Hamstrings (L)","","","Adult and Pediatric","Assessments and Examinations.Physical/Neurological Examination","","","","","","","","","","","","","","","","Supplemental","","","","","Supplemental","","","","","","","","","","","","","","","",,,,,"","",,,,"2014-04-01","2014-04-01","Published"
"MotorStrgthGastrocnmusLftAssmt","Motor strength gastrocnemius left assessment","Unique Data Element","1.0","Motor strength Gastrocnemius left assessment","Motor strength Gastrocnemius left assessment","Numeric Values","","Single Pre-Defined Value Selected","","","0;1;2;3;4;5","No muscle contraction;Visible muscle contraction, no movement;Active movement with gravity eliminated;Active movement against gravity;Less than normal strength aginst resistance;Normal strength against resistance","0;1;2;3;4;5","","Select one.","PDBD Neurolocial Examination Form","6t) Gastrocnemius (L)","","","Adult and Pediatric","Assessments and Examinations.Physical/Neurological Examination","","","","","","","","","","","","","","","","Supplemental","","","","","Supplemental","","","","","","","","","","","","","","","",,,,,"","",,,,"2014-04-01","2014-04-01","Published"
"MotorStrgthTblAnterLftAssmt","Motor strength tibialis anterior left assessment","Unique Data Element","1.0","Motor strength Tibialis Anterior left assessment","Motor strength Tibialis Anterior left assessment","Numeric Values","","Single Pre-Defined Value Selected","","","0;1;2;3;4;5","No muscle contraction;Visible muscle contraction, no movement;Active movement with gravity eliminated;Active movement against gravity;Less than normal strength aginst resistance;Normal strength against resistance","0;1;2;3;4;5","","Select one.","PDBD Neurolocial Examination Form","6v) Tibialis Anterior (L)","","","Adult and Pediatric","Assessments and Examinations.Physical/Neurological Examination","","","","","","","","","","","","","","","","Supplemental","","","","","Supplemental","","","","","","","","","","","","","","","",,,,,"","",,,,"2014-04-01","2014-04-01","Published"
"MotorStrgthAtrophInd","Motor strength atrophy indicator assessment","Unique Data Element","1.0","Motor strength atrophy indicator assessment","Motor strength atrophy findings","Alphanumeric","4000","Free-Form Entry","","","Biceps (L);Biceps (R);Deltoid (L);Deltoid (R);Gastrocnemius (L);Gastrocnemius (R);Hamstrings (L);Hamstrings (R);No atrophy present;Quadriceps (L);Quadriceps (R);Tibialis Anterior (L);Tibialis Anterior (R);Triceps (L);Triceps (R)","Biceps (L);Biceps (R);Deltoid (L);Deltoid (R);Gastrocnemius (L);Gastrocnemius (R);Hamstrings (L);Hamstrings (R);No atrophy present;Quadriceps (L);Quadriceps (R);Tibialis Anterior (L);Tibialis Anterior (R);Triceps (L);Triceps (R)",";;;;;;;;;;;;;;","","Select all that apply.","PDBD Neurolocial Examination Form","6w) Atrophy present in any muscle group(s)?","","","Adult and Pediatric","Assessments and Examinations.Physical/Neurological Examination","","","","","","","","","","","","","","","","Supplemental","","","","","Supplemental","","","","","","","","","","","","","","","",,,,,"","",,,,"2014-04-01","2014-04-01","Published"
"MotorStrgthFasciculationFind","Motor strength fasciculations findings","Unique Data Element","1.0","Motor strength fasciculations findings","Motor strength fasciculations findings","Alphanumeric","4000","Free-Form Entry","","","Biceps (L);Biceps (R);Deltoid (L);Deltoid (R);Gastrocnemius (L);Gastrocnemius (R);Hamstrings (L);Hamstrings (R);No fasciculations present;Quadriceps (L);Quadriceps (R);Tibialis Anterior (L);Tibialis Anterior (R);Triceps (L);Triceps (R)","Biceps (L);Biceps (R);Deltoid (L);Deltoid (R);Gastrocnemius (L);Gastrocnemius (R);Hamstrings (L);Hamstrings (R);No fasciculations present;Quadriceps (L);Quadriceps (R);Tibialis Anterior (L);Tibialis Anterior (R);Triceps (L);Triceps (R)",";;;;;;;;;;;;;;","","Select all that apply.","PDBD Neurolocial Examination Form","6x) Fasciculations present in any muscle group(s)?","","","Adult and Pediatric","Assessments and Examinations.Physical/Neurological Examination","","","","","","","","","","","","","","","","Supplemental","","","","","Supplemental","","","","","","","","","","","","","","","",,,,,"","",,,,"2014-04-01","2014-04-01","Published"
"SensationAssmtExamFind","Sensation assessment examination findings","Unique Data Element","1.0","Sensation assessment","Sensation assessment","Alphanumeric","","Single Pre-Defined Value Selected","","","Abnormal;Normal;Not assessed","Abnormal;Normal;Not assessed","10;20;222","","Select one.","PDBD Neurolocial Examination Form","7) Sensation","","","Adult and Pediatric","Assessments and Examinations.Physical/Neurological Examination","","","","","","","","","","","","","","","","Supplemental","","","","","Supplemental","","","","","","","","","","","","","","","",,,,,"","",,,,"2014-04-01","2014-04-01","Published"
"SensationProxmlArmRtFind","Sensation proximal arm right findings","Unique Data Element","1.0","Sensation Proximal Arm right findings","Sensation Proximal Arm right findings","Alphanumeric","4000","Free-Form Entry","","","Light Touch;Pain;Position;Temperature;Vibration","Light Touch;Pain;Position;Temperature;Vibration",";;;;","","Select all that apply.","PDBD Neurolocial Examination Form","7a) Proximal Arm (R)","","","Adult and Pediatric","Assessments and Examinations.Physical/Neurological Examination","","","","","","","","","","","","","","","","Supplemental","","","","","Supplemental","","","","","","","","","","","","","","","",,,,,"","",,,,"2014-04-01","2014-04-01","Published"
"SensationDistlArmRtFind","Sensation distal arm right findings","Unique Data Element","1.0","Sensation Distal Arm right findings","Sensation Distal Arm right findings","Alphanumeric","4000","Free-Form Entry","","","Light Touch;Pain;Position;Temperature;Vibration","Light Touch;Pain;Position;Temperature;Vibration",";;;;","","Select all that apply.","PDBD Neurolocial Examination Form","7c) Distal Arm (R)","","","Adult and Pediatric","Assessments and Examinations.Physical/Neurological Examination","","","","","","","","","","","","","","","","Supplemental","","","","","Supplemental","","","","","","","","","","","","","","","",,,,,"","",,,,"2014-04-01","2014-04-01","Published"
"SensationProxmlLegRtFind","Sensation proximal leg right findings","Unique Data Element","1.0","Sensation Proximal Leg right findings","Sensation Proximal Leg right findings","Alphanumeric","4000","Free-Form Entry","","","Light Touch;Pain;Position;Temperature;Vibration","Light Touch;Pain;Position;Temperature;Vibration",";;;;","","Select all that apply.","PDBD Neurolocial Examination Form","7e) Proximal Leg (R)","","","Adult and Pediatric","Assessments and Examinations.Physical/Neurological Examination","","","","","","","","","","","","","","","","Supplemental","","","","","Supplemental","","","","","","","","","","","","","","","",,,,,"","",,,,"2014-04-01","2014-04-01","Published"
"SensationDistlLegRtFind","Sensation distal leg right findings","Unique Data Element","1.0","Sensation Distal Leg right findings","Sensation Distal Leg right findings","Alphanumeric","4000","Free-Form Entry","","","Light Touch;Pain;Position;Temperature;Vibration","Light Touch;Pain;Position;Temperature;Vibration",";;;;","","Select all that apply.","PDBD Neurolocial Examination Form","7g) Distal Leg (R)","","","Adult and Pediatric","Assessments and Examinations.Physical/Neurological Examination","","","","","","","","","","","","","","","","Supplemental","","","","","Supplemental","","","","","","","","","","","","","","","",,,,,"","",,,,"2014-04-01","2014-04-01","Published"
"SensationProxmlArmLftFind","Sensation proximal arm left findings","Unique Data Element","1.0","Sensation Proximal Arm left findings","Sensation Proximal Arm left findings","Alphanumeric","4000","Free-Form Entry","","","Light Touch;Pain;Position;Temperature;Vibration","Light Touch;Pain;Position;Temperature;Vibration",";;;;","","Select all that apply.","PDBD Neurolocial Examination Form","7b) Proximal Arm (L)","","","Adult and Pediatric","Assessments and Examinations.Physical/Neurological Examination","","","","","","","","","","","","","","","","Supplemental","","","","","Supplemental","","","","","","","","","","","","","","","",,,,,"","",,,,"2014-04-01","2014-04-01","Published"
"SensationDistlArmLftFind","Sensation distal arm left findings","Unique Data Element","1.0","Sensation Distal Arm left findings","Sensation Distal Arm left findings","Alphanumeric","4000","Free-Form Entry","","","Light Touch;Pain;Position;Temperature;Vibration","Light Touch;Pain;Position;Temperature;Vibration",";;;;","","Select all that apply.","PDBD Neurolocial Examination Form","7d) Distal Arm (L)","","","Adult and Pediatric","Assessments and Examinations.Physical/Neurological Examination","","","","","","","","","","","","","","","","Supplemental","","","","","Supplemental","","","","","","","","","","","","","","","",,,,,"","",,,,"2014-04-01","2014-04-01","Published"
"SensationProxmlLegLftFind","Sensation proximal leg left findings","Unique Data Element","1.0","Sensation Proximal Leg left findings","Sensation Proximal Leg left findings","Alphanumeric","4000","Free-Form Entry","","","Light Touch;Pain;Position;Temperature;Vibration","Light Touch;Pain;Position;Temperature;Vibration",";;;;","","Select all that apply.","PDBD Neurolocial Examination Form","7f) Proximal Leg (L)","","","Adult and Pediatric","Assessments and Examinations.Physical/Neurological Examination","","","","","","","","","","","","","","","","Supplemental","","","","","Supplemental","","","","","","","","","","","","","","","",,,,,"","",,,,"2014-04-01","2014-04-01","Published"
"SensationDistlLegLftFind","Sensation distal leg left findings","Unique Data Element","1.0","Sensation Distal Leg left findings","Sensation Distal Leg left findings","Alphanumeric","4000","Free-Form Entry","","","Light Touch;Pain;Position;Temperature;Vibration","Light Touch;Pain;Position;Temperature;Vibration",";;;;","","Select all that apply.","PDBD Neurolocial Examination Form","7h) Distal Leg (L)","","","Adult and Pediatric","Assessments and Examinations.Physical/Neurological Examination","","","","","","","","","","","","","","","","Supplemental","","","","","Supplemental","","","","","","","","","","","","","","","",,,,,"","",,,,"2014-04-01","2014-04-01","Published"
"SensationStockingGloveFind","Sensation stocking/glove findings","Unique Data Element","1.0","Sensation  Stocking/Glove findings","Sensation  Stocking/Glove findings","Alphanumeric","4000","Free-Form Entry","","","Light Touch;Pain;Position;Temperature;Vibration","Light Touch;Pain;Position;Temperature;Vibration",";;;;","","Select all that apply.","PDBD Neurolocial Examination Form","7i) Stocking/Glove","","","Adult and Pediatric","Assessments and Examinations.Physical/Neurological Examination","","","","","","","","","","","","","","","","Supplemental","","","","","Supplemental","","","","","","","","","","","","","","","",,,,,"","",,,,"2014-04-01","2014-04-01","Published"
"ReflexInd","Reflexes indicator","Unique Data Element","1.0","Reflexes indicator","Reflexes indicator","Alphanumeric","","Single Pre-Defined Value Selected","","","Abnormal;Normal;Not assessed","Abnormal;Normal;Not assessed","10;20;222","","Select one.","PDBD Neurolocial Examination Form","8) Reflexes","","","Adult and Pediatric","Assessments and Examinations.Physical/Neurological Examination","","","","","","","","","","","","","","","","Supplemental","","","","","Supplemental","","","","","","","","","","","","","","","",,,,,"","",,,,"2014-04-01","2014-04-01","Published"
"ReflexBicepsRtAssmt","Reflexes biceps right assessment","Unique Data Element","1.0","Reflexes Biceps right assessment","Reflexes Biceps right assessment","Alphanumeric","","Single Pre-Defined Value Selected","","","0;1+;2+;3+;4+","No response;Low normal;Normal;Brisk;Very brisk with clonus","0;1;20;2;3","","Select one.","PDBD Neurolocial Examination Form","8a) Biceps (R)","","","Adult and Pediatric","Assessments and Examinations.Physical/Neurological Examination","","","","","","","","","","","","","","","","Supplemental","","","","","Supplemental","","","","","","","","","","","","","","","",,,,,"","",,,,"2014-04-01","2014-04-01","Published"
"ReflexTricepsRtAssmt","Reflexes triceps right assessment","Unique Data Element","1.0","Reflexes Triceps right assessment","Reflexes Triceps right assessment","Alphanumeric","","Single Pre-Defined Value Selected","","","0;1+;2+;3+;4+","No response;Low normal;Normal;Brisk;Very brisk with clonus","0;1;20;2;3","","Select one.","PDBD Neurolocial Examination Form","8c) Triceps (R)","","","Adult and Pediatric","Assessments and Examinations.Physical/Neurological Examination","","","","","","","","","","","","","","","","Supplemental","","","","","Supplemental","","","","","","","","","","","","","","","",,,,,"","",,,,"2014-04-01","2014-04-01","Published"
"ReflexBrachioradRtAssmt","Reflexes brachioradialis right assessment","Unique Data Element","1.0","Reflexes Brachioradialis right assessment","Reflexes Brachioradialis right assessment","Alphanumeric","","Single Pre-Defined Value Selected","","","0;1+;2+;3+;4+","No response;Low normal;Normal;Brisk;Very brisk with clonus","0;1;20;2;3","","Select one.","PDBD Neurolocial Examination Form","8e) Brachioradialis (R)","","","Adult and Pediatric","Assessments and Examinations.Physical/Neurological Examination","","","","","","","","","","","","","","","","Supplemental","","","","","Supplemental","","","","","","","","","","","","","","","",,,,,"","",,,,"2014-04-01","2014-04-01","Published"
"ReflexPatellarRtAssmt","Reflexes patellar right assessment","Unique Data Element","1.0","Reflexes Patellar right assessment","Reflexes Patellar right assessment","Alphanumeric","","Single Pre-Defined Value Selected","","","0;1+;2+;3+;4+","No response;Low normal;Normal;Brisk;Very brisk with clonus","0;1;20;2;3","","Select one.","PDBD Neurolocial Examination Form","6g) Patellar (R)","","","Adult and Pediatric","Assessments and Examinations.Physical/Neurological Examination","","","","","","","","","","","","","","","","Supplemental","","","","","Supplemental","","","","","","","","","","","","","","","",,,,,"","",,,,"2014-04-01","2014-04-01","Published"
"ReflexAchillesRtAssmt","Reflexes Achilles right assessment","Unique Data Element","1.0","Reflexes Achilles right assessment","Reflexes Achilles right assessment","Alphanumeric","","Single Pre-Defined Value Selected","","","0;1+;2+;3+;4+","No response;Low normal;Normal;Brisk;Very brisk with clonus","0;1;20;2;3","","Select one.","PDBD Neurolocial Examination Form","8i) Achilles (R)","","","Adult and Pediatric","Assessments and Examinations.Physical/Neurological Examination","","","","","","","","","","","","","","","","Supplemental","","","","","Supplemental","","","","","","","","","","","","","","","",,,,,"","",,,,"2014-04-01","2014-04-01","Published"
"ReflexBicepsLftAssmt","Reflexes biceps left assessment","Unique Data Element","1.0","Reflexes Biceps left assessment","Reflexes Biceps left assessment","Alphanumeric","","Single Pre-Defined Value Selected","","","0;1+;2+;3+;4+","No response;Low normal;Normal;Brisk;Very brisk with clonus","0;1;20;2;3","","Select one.","PDBD Neurolocial Examination Form","8b) Biceps (L)","","","Adult and Pediatric","Assessments and Examinations.Physical/Neurological Examination","","","","","","","","","","","","","","","","Supplemental","","","","","Supplemental","","","","","","","","","","","","","","","",,,,,"","",,,,"2014-04-01","2014-04-01","Published"
"ReflexTricepsLftAssmt","Reflexes triceps left assessment","Unique Data Element","1.0","Reflexes Triceps left assessment","Reflexes Triceps left assessment","Alphanumeric","","Single Pre-Defined Value Selected","","","0;1+;2+;3+;4+","No response;Low normal;Normal;Brisk;Very brisk with clonus","0;1;20;2;3","","Select one.","PDBD Neurolocial Examination Form","8d) Triceps (L)","","","Adult and Pediatric","Assessments and Examinations.Physical/Neurological Examination","","","","","","","","","","","","","","","","Supplemental","","","","","Supplemental","","","","","","","","","","","","","","","",,,,,"","",,,,"2014-04-01","2014-04-01","Published"
"ReflexBrachioradLtAssmt","Reflexes brachioradialis left assessment","Unique Data Element","1.0","Reflexes Brachioradialis left assessment","Reflexes Brachioradialis left assessment","Alphanumeric","","Single Pre-Defined Value Selected","","","0;1+;2+;3+;4+","No response;Low normal;Normal;Brisk;Very brisk with clonus","0;1;20;2;3","","Select one.","PDBD Neurolocial Examination Form","8f) Brachioradialis (L)","","","Adult and Pediatric","Assessments and Examinations.Physical/Neurological Examination","","","","","","","","","","","","","","","","Supplemental","","","","","Supplemental","","","","","","","","","","","","","","","",,,,,"","",,,,"2014-04-01","2014-04-01","Published"
