"variable name","title","element type","version","definition","short description","datatype","maximum character quantity","input restriction","minimum value","maximum value","permissible values","permissible value descriptions","permissible value output codes","unit of measure","guidelines/instructions","notes","preferred question text","keywords","references","population.all","domain.general (for all diseases)","domain.traumatic brain injury","domain.Parkinson's disease","domain.Friedreich's ataxia","domain.stroke","domain.amyotrophic lateral sclerosis","domain.Huntington's disease","domain.multiple sclerosis","domain.neuromuscular diseases","domain.myasthenia gravis","domain.spinal muscular atrophy","domain.Duchenne muscular dystrophy/Becker muscular dystrophy","domain.congenital muscular dystrophy","domain.spinal cord injury","domain.headache","domain.epilepsy","classification.general (for all diseases)","classification.acute hospitalized","classification.concussion/mild TBI","classification.epidemiology","classification.moderate/severe TBI: rehabilitation","classification.Parkinson's disease","classification.Friedreich's ataxia","classification.stroke","classification.amyotrophic lateral sclerosis","classification.Huntington's disease","classification.multiple sclerosis","classification.neuromuscular diseases","classification.myasthenia gravis","classification.spinal muscular atrophy","classification.Duchenne muscular dystrophy/Becker muscular dystrophy","classification.congenital muscular dystrophy","classification.spinal cord injury","classification.headache","classification.epilepsy","historical notes","Label(s)","see also","submitting organization name","submitting contact name","submitting contact information","effective date","until date","steward organization name","steward contact name","steward contact information","creation date","last change date","administrative status"
"SiteName","Site name","Common Data Element","1.5","The name of the site for the study","The name of the site for the study","Alphanumeric","255","Free-Form Entry","","","","","","","Enter the name of the study site","","Name of the site:","","No references available","Adult and Pediatric","Protocol Experience.Participant/Subject Identification, Eligibility, and Enrollment","","Treatment/Intervention Data.Drugs","","","","","","Assessments and Examinations.Imaging Diagnostics","Assessments and Examinations.Imaging Diagnostics","Assessments and Examinations.Imaging Diagnostics","","","","","","Supplemental","","","","","Supplemental","","","","","","Supplemental","Supplemental","Supplemental","","","","","","Site name","","","NIH/NINDS","NINDSCDE","NINDSCDE@emmes.com","","","NIH/NINDS","NINDSCDE","NINDSCDE@emmes.com","","2016-06-15","Published"
"VisitTypPDBP","Parkinson's Disease Biomarker's Program (PDBP) - visit type","Unique Data Element","1.0","Parkinson's Disease Biomarker's Program (PDBP) - visit type","PDBP - visit type","Alphanumeric","","Single Pre-Defined Value Selected","","","12 months;18 months;24 months;30 months;36 months;42 months;48 months;54 months;60 months;6 months;72 months;Baseline;Screening","12 months;18 months;24 months;30 months;36 months;42 months;48 months;54 months;60 months;6 months;72 months;Baseline;Screening",";;;;;;;;;;;;","","The type of visit from the visit types available for this particular study","",,"","No references available","Adult and Pediatric","","","Assessments and Examinations.Other Clinical Data","","","","","","","","","","","","","","","","","","","Supplemental","","","","","","","","","","","","","","","",,,,,"","",,,,"2014-04-01","2014-04-01","Published"
"VisitDate","Visit date","Common Data Element","1.4","Interview or visit date (actually the date when data in the form were captured)","Interview or visit date","Date or Date & Time","","Free-Form Entry","","","","","","","Record the date/time according to the ISO 8601, the International Standard for the representation of dates and times (http://www.iso.org/iso/home.html). The date/time should be recorded to the level of granularity known (e.g., year, year and month, complete date plus hours and minutes, etc.).","Data Sharing Instructions: When date/time data are prepared for aggregation or sharing they should be converted to the format specified by ISO 8601, YYYY-MM-DDThh:mm:ss.","Visit date:","","21 CFR 50.20 General requirements for informed consent A Guide to Informed Consent - Information Sheet: Guidance for Institutional Review Boards and Clinical Investigators Contents (http://www.fda.gov/RegulatoryInformation/Guidances/ucm126431.htm#general)","Adult and Pediatric","Protocol Experience.Participant/Subject Identification, Eligibility, and Enrollment","","","","","","","","","","","","","","","","Supplemental","","","","","","","","","","","","","","","","","","","Visit date","","","NIH/NINDS","NINDSCDE","NINDSCDE@emmes.com","","","NIH/NINDS","NINDSCDE","NINDSCDE@emmes.com","","2016-06-15","Published"
"GUID","GUID","Common Data Element","1.4","Global Unique ID (GUID) which uniquely identifies a subject","Global Unique ID which uniquely identifies a subject","GUID","","Free-Form Entry","","","","","","","","","Global Unique ID (GUID) which uniquely identifies the subject:","Imaging_Read;Imaging","Johnson, S.B., Whitney, G., McAuliffe, M., Wang, H., McCreedy, E., Rozenblit, L., and Evans, C.C. (2010). Using Global Unique identifiers to link autism collections. J. Am. Med. Inform. Assoc., in press. Published online July 17, 2010. 10.1136/jamia.2009.002063.","Adult and Pediatric","Protocol Experience.Participant/Subject Identification, Eligibility, and Enrollment","Participant/Subject Characteristics.Demographics","Participant/Subject Characteristics.Demographics","","","","","","","","","","","","","","Supplemental","Supplemental","Supplemental","Supplemental","Supplemental","Supplemental","","","","","","","","","","","","","","","","","NIH/NINDS","NINDSCDE","NINDSCDE@emmes.com","","","NIH/NINDS","NINDSCDE","NINDSCDE@emmes.com","2014-04-01","2016-03-07","Published"
"AgeYrs","Age in years","Unique Data Element","1.4","Value for participant's subject age, calculated as elapsed time since the birth of the participant/subject in years. The subjects age is typically recorded to the nearest full year completed, e.g. 11 years and 6 months should be recorded as 11 years.","Value for participant's subject age recorded in years.","Numeric Values","","Free-Form Entry","0","150","","","","","The subject's age is typically recorded to the nearest full year completed, e.g. 11 years and 6 months should be recorded as 11 years. For subject's which are under 1 year old, use decimal points and use the following convention- record 1 month as 0.083 (1/12), 2 months as 0.166 (2/12), 3 months as 0.25 (3/12), 4 months as 0.333 (4/12), 5 months as 0.416 (5/12), 6 months as 0.5 (6/12), 7 months as 0.583 (7/12), 8 months as 0.666 (8/12), 9 months as 0.75 (9/12), 10 months as 0.833 (10/12), 11 months as 0.916 (11/12) and 12 months as 1 year. For the individuals 90 or older, in order to preserve PII, please submit ""150""  and make a note this in the ""general notes"" column.",,"Subject's age (recorded in years):","","No references available","Adult and Pediatric","Participant/Subject Characteristics.Demographics","","Participant/Subject Characteristics.Demographics","","","","","","","","","","","","","","Supplemental","","","","","Supplemental","","","","","","","","","","","","","",,"","","NIH/CIT/BRICS","Olga Vovk","olga.vovk@nih.gov","","","NIH/CIT/BRICS","Olga Vovk","olga.vovk@nih.gov","","2017-02-21","Published"
"AgeRemaindrMonths","Age remainder in months","Unique Data Element","1.0","Remainder Value for participant's subject age when age in years (see Age in years) is recorded.","Remainder Value for participant's subject age when age in years (see Age in years) is recorded.","Numeric Values","","Free-Form Entry","0","11","","","","","","Use in conjunction with Age in years",,"","No references available","Adult and Pediatric","Participant/Subject Characteristics.Demographics","","","","","","","","","","","","","","","","Supplemental","","","","","Supplemental","","","","","","","","","","","","","","","",,,,,"","",,,,"2014-04-01","2014-04-01","Published"
"AgeVal","Age value","Common Data Element","1.2","Value for participant/subject's age, calculated as elapsed time since the birth of the participant/subject.","Value for participant's subject age, calculated as elapsed time since the birth of the participant/subject.","Numeric Values","","Free-Form Entry","0","1800","","","","Month","GENERAL/TBI: For children younger than one year born at less than 36 weeks gestation, it is recommended to also collect gestational age. Recording date of birth will give the most detailed information required for calculation of age and is recommended as first choice. However, in some studies recording date of birth may elicit discussions on a potential violation of privacy legislation and specifically HIPAA regulations. In these cases, the calculated age should be recorded.
MG/NMD/SMA: This is recorded for each brain MRI performed. This is a derived field from Date of Birth and Visit Date.
HEADACHE: It is recommended that age be calculated from date of birth and the study enrollment date. However, if age needs to be collected (e.g., full date of birth is not allowed to be collected) then it should be recorded in months and years. This element is recommended as Core for pediatric headache studies.
","","Age","","No references available","Adult and Pediatric","Participant/Subject Characteristics.Demographics","Participant/Subject Characteristics.Demographics;Disease/Injury Related Events.Classification","","","","","","","Assessments and Examinations.Imaging Diagnostics","Assessments and Examinations.Imaging Diagnostics","Assessments and Examinations.Imaging Diagnostics","","","","Participant/Subject Characteristics.Demographics","Assessments and Examinations.Non-Imaging Diagnostics","Supplemental","Basic","Basic","Supplemental","Supplemental","","","","","","","Supplemental","Supplemental","Supplemental","","","","Core","Supplemental","Age value","","","NIH/CIT/BRICS","Olga Vovk","olga.vovk@nih.gov","","","NIH/NINDS","NINDSCDE","NINDSCDE@emmes.com","","2015-07-30","Published"
"InclusnXclusnCntrlInd","Inclusion Exclusion Criteria Control Indicator","Unique Data Element","1.0","Indicated if the participant is subject or control","Subject or Control Indicator","Alphanumeric","","Single Pre-Defined Value Selected","","","Case;Control","Case;Control","1;2","","","","Is the participant/subject a control?","","No references available","Adult and Pediatric","Protocol Experience.Participant/Subject Identification, Eligibility, and Enrollment","","","","","","","","","","","","","","","","Supplemental","","","","","Supplemental","","","","","","","","","","","","","","","",,,,,"","",,,,"2014-04-01","2014-04-01","Published"
"NeuroExamPrimaryDiagnos","Neurological examination primary diagnosis","Unique Data Element","1.0","Neurological exam primary diagnosis","Neurological exam primary diagnosis","Alphanumeric","55","Free-Form Entry","","","Corticobasal Degeneration;Dementia with Lewy Bodies;Multisystem Atrophy;Other, specify;Parkinson's disease;Parkinson's Disease Dementia;Progressive Supranuclear Palsy","Corticobasal Degeneration;Dementia with Lewy Bodies;Multisystem Atrophy;Other, specify;Parkinson's disease;Parkinson's Disease Dementia;Progressive Supranuclear Palsy",";;;;;;","","Select one","PDBD Neurolocial Examination Form","2a) Primary diagnosis","","","Adult","Disease/Injury Related Events.History of Disease/Injury Event","","","","","","","","","","","","","","","","Supplemental","","","","","Supplemental","","","","","","","","","","","","","","","",,,,,"","",,,,"2014-04-01","2014-04-01","Published"
"AgeDiagnosYrs","Neurological examination age at diagnosis in years","Unique Data Element","1.0","Value for participant's subject age, calculated as elapsed time since the birth of the participant/subject to time of diagnosis in years","Value for participant's subject age at time of diagnosis in years","Numeric Values","","Free-Form Entry","0","120","","","","","Enter the subject age in full years. Use in conjunction with Age of diagnosis in months","No references available","2b) Age at diagnosis","","","Adult and Pediatric","Participant/Subject Characteristics.Demographics","","","","","","","","","","","","","","","","Supplemental","","","","","Supplemental","","","","","","","","","","","","","","","",,,,,"","",,,,"2014-04-01","2014-04-01","Published"
"AgeDiagnosRemaindrMonths","Neurological examination age at diagnosis remainder in months","Unique Data Element","1.0","Remainder value for participant's subject age when age in years (see Age at diagnosis in years) is recorded","Remainder value for participant's subject age when age in years (see Age in years) is recorded","Numeric Values","","Single Pre-Defined Value Selected","","","0;1;10;11;2;3;4;5;6;7;8;9","0;1;10;11;2;3;4;5;6;7;8;9","0;1;10;11;2;3;4;5;6;7;8;9","","Use in conjunction with Age of diagnosis in years","No references available","Plus months","","","Adult and Pediatric","Participant/Subject Characteristics.Demographics","","","","","","","","","","","","","","","","Supplemental","","","","","Supplemental","","","","","","","","","","","","","","","",,,,,"","",,,,"2014-04-01","2014-04-01","Published"
"NeuroExamFind","Neurological examination findings","Unique Data Element","1.0","Neurological examination findings","Neurological examination findings","Alphanumeric","","Single Pre-Defined Value Selected","","","Abnormal;Normal;Not assessed","Abnormal;Normal;Not assessed","10;20;222","","Select one.","PDBD Neurolocial Examination Form","3) Neurological examination findings","","","Adult and Pediatric","Assessments and Examinations.Physical/Neurological Examination","","","","","","","","","","","","","","","","Supplemental","","","","","Supplemental","","","","","","","","","","","","","","","",,,,,"","",,,,"2014-04-01","2014-04-01","Published"
"NeuroExamAbnrmlFindDocumntd","Abnormal neurological examination findings documented in another form indicator","Unique Data Element","1.0","Whether abnormal Neurological examination findings were  documented in another form e.g., MDS-UPDRS, MoCA, Hamilton","Abnormal neurological examination findings documented in another form indicator","Alphanumeric","","Single Pre-Defined Value Selected","","","No;Yes","No;Yes","0;1","","Select one.","PDBD Neurolocial Examination Form","3a) If abnormal, is abnormality documented in another form, e.g., MDS-UPDRS, MoCA, Hamilton?","","","Adult and Pediatric","Assessments and Examinations.Physical/Neurological Examination","","","","","","","","","","","","","","","","Supplemental","","","","","Supplemental","","","","","","","","","","","","","","","",,,,,"","",,,,"2014-04-01","2014-04-01","Published"
"MentlStatExamFind","Mental status examination findings","Unique Data Element","1.0","Neurological examination mental status findings","Mental status examination","Alphanumeric","","Single Pre-Defined Value Selected","","","Abnormal;Normal;Not assessed","Abnormal;Normal;Not assessed","10;20;222","","Select one.","PDBD Neurolocial Examination Form","4) Mental status examination","","","Adult and Pediatric","Assessments and Examinations.Physical/Neurological Examination","","","","","","","","","","","","","","","","Supplemental","","","","","Supplemental","","","","","","","","","","","","","","","",,,,,"","",,,,"2014-04-01","2014-04-01","Published"
"MentlStatExamCogAbnrmlyTxt","Mental status examination cognitive abnormality text","Unique Data Element","1.0","Text description of cognitive abnormality","Text description of cognitive abnormality","Alphanumeric","4000","Free-Form Entry","","","","","","","If no abnormalities, write ""None.""","PDBD Neurolocial Examination Form","4a) Describe cognitive abnormality, e.g., dyspraxia, neglect, perseveration, etc. If none, write &quot;None.&quot;","","","Adult and Pediatric","Assessments and Examinations.Physical/Neurological Examination","","","","","","","","","","","","","","","","Supplemental","","","","","Supplemental","","","","","","","","","","","","","","","",,,,,"","",,,,"2014-04-01","2014-04-01","Published"
"MentlStatExamMoodAbnrmlyTxt","Mental status examination mood or affect abnormality text","Unique Data Element","1.0","Text description of mood or affect abnormality","Text description of mood or affect abnormality","Alphanumeric","4000","Free-Form Entry","","","","","","","If no abnormalities, write ""None.""","PDBD Neurolocial Examination Form","4b) Describe other mood or affect abnormality, e.g., pseudobulbar affect, irritability, elation, etc. If none, write &quot;None.&quot;","","","Adult and Pediatric","Assessments and Examinations.Physical/Neurological Examination","","","","","","","","","","","","","","","","Supplemental","","","","","Supplemental","","","","","","","","","","","","","","","",,,,,"","",,,,"2014-04-01","2014-04-01","Published"
"CranlNervExamFind","Cranial nerves II-XII examination findings","Unique Data Element","1.0","Cranial nerves II-XII examination findings","Cranial nerves II-XII examination findings","Alphanumeric","","Single Pre-Defined Value Selected","","","Abnormal;Normal;Not assessed","Abnormal;Normal;Not assessed","10;20;222","","Select one.","PDBD Neurolocial Examination Form","5) Cranial nerves II-XII examination","","","Adult and Pediatric","Assessments and Examinations.Physical/Neurological Examination","","","","","","","","","","","","","","","","Supplemental","","","","","Supplemental","","","","","","","","","","","","","","","",,,,,"","",,,,"2014-04-01","2014-04-01","Published"
"CranlNervVisualAcuityFind","Cranial nerves II-XII visual acuity (corrected) findings","Unique Data Element","1.0","Cranial nerves II-XII visual acuity (corrected) findings.","Cranial nerves II-XII visual acuity (corrected) findings.","Alphanumeric","","Single Pre-Defined Value Selected","","","Abnormal;Normal;Not assessed","Abnormal;Normal;Not assessed","10;20;222","","Select one.","PDBD Neurolocial Examination Form","5a) Visual acuity (corrected)","","","Adult and Pediatric","Assessments and Examinations.Physical/Neurological Examination","","","","","","","","","","","","","","","","Supplemental","","","","","Supplemental","","","","","","","","","","","","","","","",,,,,"","",,,,"2014-04-01","2014-04-01","Published"
"CranlNervVisualAcuityAbnrmly","Cranial nerves II-XII visual acuity abnormality findings","Unique Data Element","1.0","Cranial nerves II-XII visual acuity abnormality descriptor findings","Cranial nerves II-XII visual acuity abnormality descriptor","Alphanumeric","4000","Free-Form Entry","","","Able to read text;Detects light only;Detects movement only;Vision impaired on left;Vision impaired on right","Able to read text;Detects light only;Detects movement only;Vision impaired on left;Vision impaired on right",";;;;","","Select all that apply","PDBD Neurolocial Examination Form","5a-i) If abnormal, check all that apply","","","Adult and Pediatric","Assessments and Examinations.Physical/Neurological Examination","","","","","","","","","","","","","","","","Supplemental","","","","","Supplemental","","","","","","","","","","","","","","","",,,,,"","",,,,"2014-04-01","2014-04-01","Published"
"CranlNervPapilledemaFind","Cranial nerves II-XII Papilledema  findings","Unique Data Element","1.0","Cranial nerves II-XII Papilledema findings","Cranial nerves II-XII Papilledema findings","Alphanumeric","","Single Pre-Defined Value Selected","","","Bilateral;Left;Normal;Not assessed;Right","Bilateral;Left;Normal;Not assessed;Right","6;4;20;222;5","","Select one.","PDBD Neurolocial Examination Form","5b) Papilledema","","","Adult and Pediatric","Assessments and Examinations.Physical/Neurological Examination","","","","","","","","","","","","","","","","Supplemental","","","","","Supplemental","","","","","","","","","","","","","","","",,,,,"","",,,,"2014-04-01","2014-04-01","Published"
"CranlNervDiscPallorFind","Cranial nerves II-XII disc pallor findings","Unique Data Element","1.0","Cranial nerves II-XII disc pallor findings","Cranial nerves II-XII disc pallor findings","Alphanumeric","","Single Pre-Defined Value Selected","","","Bilateral;Left;Normal;Not assessed;Right","Bilateral;Left;Normal;Not assessed;Right","6;4;20;222;5","","Select one.","PDBD Neurolocial Examination Form","5c) Disc pallor","","","Adult and Pediatric","Assessments and Examinations.Physical/Neurological Examination","","","","","","","","","","","","","","","","Supplemental","","","","","Supplemental","","","","","","","","","","","","","","","",,,,,"","",,,,"2014-04-01","2014-04-01","Published"
"CranlNervPupilsFind","Cranial nerves II-XII pupils findings","Unique Data Element","1.0","Cranial nerves II-XII pupils findings","Cranial nerves II-XII pupils findings","Alphanumeric","","Single Pre-Defined Value Selected","","","Abnormal;Normal;Not assessed","Abnormal;Normal;Not assessed","10;20;222","","Select one.","PDBD Neurolocial Examination Form","5d) Pupils","","","Adult and Pediatric","Assessments and Examinations.Physical/Neurological Examination","","","","","","","","","","","","","","","","Supplemental","","","","","Supplemental","","","","","","","","","","","","","","","",,,,,"","",,,,"2014-04-01","2014-04-01","Published"
"CranlNervPupilsAbnrmlyFind","Cranial nerves II-XII pupils abnormality findings","Unique Data Element","1.0","Cranial nerves II-XII pupils abnormality findings","Cranial nerves II-XII pupils abnormality findings","Alphanumeric","4000","Free-Form Entry","","","Left at rest;Left to accomodation;Left to light;Right at rest;Right to accomodation;Right to light","Left at rest;Left to accomodation;Left to light;Right at rest;Right to accomodation;Right to light",";;;;;","","Select all that apply.","PDBD Neurolocial Examination Form","5d-i) If abnormal, check all abnormalities found","","","Adult and Pediatric","Assessments and Examinations.Physical/Neurological Examination","","","","","","","","","","","","","","","","Supplemental","","","","","Supplemental","","","","","","","","","","","","","","","",,,,,"","",,,,"2014-04-01","2014-04-01","Published"
"CranlNervPtosisLocFind","Cranial nerves II-XII Ptosis findings","Unique Data Element","1.0","Cranial nerves II-XII Ptosis findings","Cranial nerves II-XII Ptosis findings","Alphanumeric","","Single Pre-Defined Value Selected","","","Bilateral;Left;Normal;Not assessed;Right","Bilateral;Left;Normal;Not assessed;Right","6;4;20;222;5","","Select one.","PDBD Neurolocial Examination Form","5e) Ptosis","","","Adult and Pediatric","Assessments and Examinations.Physical/Neurological Examination","","","","","","","","","","","","","","","","Supplemental","","","","","Supplemental","","","","","","","","","","","","","","","",,,,,"","",,,,"2014-04-01","2014-04-01","Published"
"CranlNervVisualFieldsFind","Cranial nerves II-XII visual fields findings","Unique Data Element","1.0","Cranial nerve II-XII visual fields findings","Cranial nerve II-XII visual fields findings","Alphanumeric","","Single Pre-Defined Value Selected","","","Abnormal;Normal;Not assessed","Abnormal;Normal;Not assessed","10;20;222","","Select one.","PDBD Neurolocial Examination Form","5f) Visual fields","","","Adult and Pediatric","Assessments and Examinations.Physical/Neurological Examination","","","","","","","","","","","","","","","","Supplemental","","","","","Supplemental","","","","","","","","","","","","","","","",,,,,"","",,,,"2014-04-01","2014-04-01","Published"
"CranlNervHemianopiaLoc","Cranial nerves II-XII hemianopia location(s)","Unique Data Element","1.0","Cranial nerves II-XII area(s) of hemianopia locations(s)","Cranial nerves II-XII area(s) of hemianopia locations(s)","Alphanumeric","4000","Free-Form Entry","","","Left Inferior;Left Lateral;Left Medial;Left Superior;Not applicable;Right Inferior;Right Lateral;Right Medial;Right Superior","Left Inferior;Left Lateral;Left Medial;Left Superior;Not applicable;Right Inferior;Right Lateral;Right Medial;Right Superior",";;;;;;;;","","Select all that apply.","PDBD Neurolocial Examination Form","5f-i) Note area(s) of hemianopia","","","Adult and Pediatric","Assessments and Examinations.Physical/Neurological Examination","","","","","","","","","","","","","","","","Supplemental","","","","","Supplemental","","","","","","","","","","","","","","","",,,,,"","",,,,"2014-04-01","2014-04-01","Published"
"CranlNervQuadrantanopiaLoc","Cranial nerves II-XII quadrantanopia location(s)","Unique Data Element","1.0","Cranial nerves II-XII area(s) of quadrantanopia","Cranial nerves II-XII area(s) of quadrantanopia","Alphanumeric","4000","Free-Form Entry","","","Left Inferior;Left Lateral;Left Medial;Left Superior;Not applicable;Right Inferior;Right Lateral;Right Medial;Right Superior","Left Inferior;Left Lateral;Left Medial;Left Superior;Not applicable;Right Inferior;Right Lateral;Right Medial;Right Superior",";;;;;;;;","","Select all that apply.","PDBD Neurolocial Examination Form","5f-ii) Note area(s) of  quadrantanopia","","","Adult and Pediatric","Assessments and Examinations.Physical/Neurological Examination","","","","","","","","","","","","","","","","Supplemental","","","","","Supplemental","","","","","","","","","","","","","","","",,,,,"","",,,,"2014-04-01","2014-04-01","Published"
